{
  "schema_version": "1.0.0",
  "timestamp": "2026-01-15T10:00:00Z",
  "logger": "starlink-security",
  "level": "INFO",
  "module": "auth_handler",
  "line": 42,
  "message": "User authentication successful",
  "service": "starlink-security",
  "component": "authentication",
  "user_id": "user-12345",
  "privacy_tags": ["PII", "REDACTED"],
  "environment": "production",
  "action": "LOGIN",
  "result": "SUCCESS"
}
